{
        "ip_addresses": [],
        "aliases": [],
        "acronyms": [
            "ANU"
        ],
        "links": [
            "http://www.anu.edu.au/"
        ],
        "country": {
            "country_code": "AU",
            "country_name": "Australia"
        },
        "name": "Australian National University",
        "wikipedia_url": "http://en.wikipedia.org/wiki/Australian_National_University",
        "addresses": [
            {
                "lat": -35.2778,
                "state_code": "AU-ACT",
                "country_geonames_id": 2077456,
                "lng": 149.1205,
                "state": "Australian Capital Territory",
                "city": "Canberra",
                "geonames_city": {
                    "nuts_level2": {
                        "name": null,
                        "code": null
                    },
                    "geonames_admin2": {
                        "ascii_name": null,
                        "id": null,
                        "name": null,
                        "code": null
                    },
                    "geonames_admin1": {
                        "ascii_name": "ACT",
                        "id": 2177478,
                        "name": "ACT",
                        "code": "AU.01"
                    },
                    "city": "Canberra",
                    "id": 2172517,
                    "nuts_level1": {
                        "name": null,
                        "code": null
                    },
                    "nuts_level3": {
                        "name": null,
                        "code": null
                    },
                    "license": {
                        "attribution": "Data from geonames.org under a CC-BY 3.0 license",
                        "license": "http://creativecommons.org/licenses/by/3.0/"
                    }
                },
                "postcode": null,
                "primary": false,
                "line": null
            }
        ],
        "types": [
            "Education"
        ],
        "established": 1946,
        "relationships": [
            {
                "type": "Related",
                "id": "https://ror.org/041c7s516",
                "label": "Calvary Hospital"
            },
            {
                "type": "Related",
                "id": "https://ror.org/04h7nbn38",
                "label": "Canberra Hospital"
            },
            {
                "type": "Related",
                "id": "https://ror.org/030jpqj15",
                "label": "Goulburn Base Hospital"
            },
            {
                "type": "Child",
                "id": "https://ror.org/006a4jj40",
                "label": "Mount Stromlo Observatory"
            }
        ],
        "email_address": null,
        "external_ids": {
            "GRID": {
                "all": "grid.1001.0",
                "preferred": "grid.1001.0"
            }
        },
        "id": "https://ror.org/019wvm592",
        "labels": [],
        "status": "active"
    }
